{
  "$schema": "http://json-schema.org/draft-07/schema#",
  "title": "FenixGeneral_SendTemplateToThisDomain Request, version 1.0",
  "type": "object",
  "properties": {
    "testCaseExecutionId": {
      "type": "string"
    },
    "testStepClassName": {
      "type": "string",
      "enum": [
        "FenixGeneral"
      ]
    },
    "testStepActionMethod": {
      "type": "string",
      "enum": [
        "SendTemplateToThisDomain_v1_0"
      ]
    },
    "testDataParameterType": {
      "type": "string",
      "enum": [
        "FixedValue"
      ]
    },
    "expectedToBePassed": {
      "type": "boolean",
      "enum": [
        true,
        false
      ]
    },
    "methodParameters": {
      "type": "object",
      "$ref": "#/definitions/MethodParameters"
    }
  },
  "required": [
    "testCaseExecutionId",
    "testStepClassName",
    "testStepActionMethod",
    "testDataParameterType",
    "expectedToBePassed",
    "methodParameters"
  ],
  "additionalProperties": false,
  "definitions": {
    "MethodParameters": {
      "type": "object",
      "properties": {
        "MethodParametersJsonAsString": {
          "type": "string"
        }
      },
      "required": [
        "MethodParametersJsonAsString"
      ],
      "additionalProperties": false
    }
  }
}
