{
  "testCaseExecutionId": "a0161997-4323-45a8-93fa-8ff7d64d1b7a",
  "testStepClassName": "FenixGeneral",
  "testStepActionMethod": "SendTemplateToThisDomain_v1_0",
  "testDataParameterType": "FixedValue",
  "methodParameters": {
    "MethodParametersJsonAsString": "{\"TestInstructionVersion\": \"v1.0\", \"ExpectedToBePassed\": \"true\", \"TestCaseExecutionUuid\": \"a0161997-4323-45a8-93fa-8ff7d64d1b7a\", \"TestInstructionExecutionUuid\": \"ae344db4-2d34-474e-bd91-1b24ac408b75\", \"TestInstructionExecutionVersion\": \"1\", \"TestInstructionVersion\": \"v1.0\", \"TimeoutTimeInSeconds\": \"30\"}"
  },
  "expectedToBePassed": true
}

